{
  "meta": {
    "schema": "weekly",
    "schema_version": "0.1",
    "revision": 1,
    "created_at": "2026-10-03T21:36:40+09:00",
    "updated_at": "2026-10-03T21:36:40+09:00",
    "updated_by": "pipeline"
  },
  "project_id": "P-DAT-105",
  "week": "2026-W39",
  "range": {
    "from": "2026-09-21",
    "to": "2026-09-27"
  },
  "source_daily_ids": [
    "D-260922-tester-05"
  ],
  "headline": {
    "text": "수율 95.0% → 96.0% 확인",
    "source_ids": [
      "D-260922-tester-05"
    ],
    "kind": "fact",
    "changed": true
  },
  "progress": [
    {
      "text": "수율 95.0% → 96.0% 확인",
      "source_ids": [
        "D-260922-tester-05"
      ],
      "kind": "fact",
      "changed": true
    }
  ],
  "next_plan": [],
  "issues": [],
  "milestone_updates": [],
  "no_change": false,
  "budget": {
    "max_chars_per_line": 50,
    "lines": {
      "progress": 7,
      "next_plan": 3,
      "issues": 2
    }
  },
  "review_state": "draft",
  "ai": {
    "model": "mock",
    "prompt_id": "weekly_rollup",
    "prompt_version": "v0.2",
    "generated_at": "2026-10-03T21:36:40+09:00",
    "input_revisions": {
      "D-260922-tester-05": 1
    }
  }
}
