{
  "meta": {
    "schema": "weekly",
    "schema_version": "0.1",
    "revision": 1,
    "created_at": "2026-10-03T21:47:56+09:00",
    "updated_at": "2026-10-03T21:47:56+09:00",
    "updated_by": "pipeline"
  },
  "project_id": "P-APC-101",
  "week": "2026-W37",
  "range": {
    "from": "2026-09-07",
    "to": "2026-09-13"
  },
  "source_daily_ids": [],
  "headline": {
    "text": "금주(W37) 변경 없음",
    "source_ids": [],
    "kind": "fact",
    "changed": true
  },
  "progress": [],
  "next_plan": [],
  "issues": [],
  "milestone_updates": [],
  "no_change": true,
  "budget": {
    "max_chars_per_line": 50,
    "lines": {
      "progress": 7,
      "next_plan": 3,
      "issues": 2
    }
  },
  "review_state": "draft",
  "ai": {
    "model": "AI 호출 없음 (Daily 없음)",
    "prompt_id": "weekly_rollup",
    "prompt_version": "v0.2",
    "generated_at": "2026-10-03T21:47:56+09:00",
    "input_revisions": {}
  }
}
